results/processed/test_mm_n_sweep_summary.csv
M,K,N,SplitK,compression_ratio,zipserv_time_ms,cublas_tc_time_ms,cublas_nontc_time_ms,zipserv_tflops,cublas_tc_tflops,cublas_nontc_tflops,speedup_vs_cublas_tc,speedup_vs_cublas_nontc,log_file
4096,4096,1,1,1.42,0.098,0.076,0.074,0.34,0.44,0.45,0.7755102040816326,0.7551020408163265,logs/experiments/n_sweep/test_mm_4096_4096_1_1.log
4096,4096,8,1,1.42,0.096,0.077,0.451,2.79,3.48,0.6,0.8020833333333333,4.697916666666667,logs/experiments/n_sweep/test_mm_4096_4096_8_1.log
4096,4096,16,1,1.42,0.097,0.077,0.45,5.51,6.98,1.19,0.7938144329896907,4.639175257731959,logs/experiments/n_sweep/test_mm_4096_4096_16_1.log
4096,4096,32,1,1.42,0.098,0.077,0.459,10.91,13.95,2.34,0.7857142857142857,4.683673469387755,logs/experiments/n_sweep/test_mm_4096_4096_32_1.log
4096,4096,64,1,1.42,0.106,0.086,0.499,20.26,25.11,4.31,0.8113207547169811,4.7075471698113205,logs/experiments/n_sweep/test_mm_4096_4096_64_1.log
4096,4096,128,1,1.42,0.139,0.1,0.501,30.81,42.76,8.57,0.7194244604316546,3.6043165467625897,logs/experiments/n_sweep/test_mm_4096_4096_128_1.log
4096,4096,256,1,1.42,0.164,0.119,0.539,52.25,72.1,15.94,0.725609756097561,3.2865853658536586,logs/experiments/n_sweep/test_mm_4096_4096_256_1.log
4096,4096,512,1,1.42,0.309,0.235,1.062,55.52,73.2,16.18,0.7605177993527508,3.4368932038834954,logs/experiments/n_sweep/test_mm_4096_4096_512_1.log
